profile,animations,frame_width,frame_height,anchor_x,anchor_y,min_top_side_padding_px,min_floor_padding_px,min_side_padding_px,recommended_source_canvas_px,notes
default_128,"idle;walk;run;sprint;dodge;hurt;block;interact",128,128,64,120,12,8,12,512,"Default character-size gameplay profile. Generate one raw source frame at a time on a larger transparent/#ff00ff canvas; preserve empty padding and normalize later with shared scale."
expanded_action_384,"attack;cast;special;skill;death;large_effect",384,384,192,376,96,8,96,1536,"Expanded action profile for large body motion, weapons, wings, tails, leaps, spells, flashes, and special effects. Preserve full-envelope whitespace; do not scale body/effects up to fill canvas."
monster_medium_256,"idle;walk;run;sprint;dodge;hurt;block;interact",256,256,128,240,32,16,32,1024,"Medium monster gameplay profile. Use for monsters about 2 times character size. Core body target is 70-75% of frame, hard max 80% before effects."
monster_medium_action_768,"attack;cast;special;skill;death;large_effect",768,768,384,752,192,16,192,3072,"Medium monster expanded action profile. Keep core body at medium gameplay footprint; preserve full-envelope whitespace around attacks/effects."
monster_large_384,"idle;walk;run;sprint;dodge;hurt;block;interact",384,384,192,360,48,24,48,1536,"Large monster gameplay profile. Use for monsters about 3 times character size. Core body target is 70-75% of frame, hard max 80% before effects."
monster_large_action_1152,"attack;cast;special;skill;death;large_effect",1152,1152,576,1128,288,24,288,4608,"Large monster expanded action profile. Keep core body at large gameplay footprint; preserve full-envelope whitespace around attacks/effects."
