profile,animations,frame_width,frame_height,anchor_x,anchor_y,min_top_side_padding_px,min_floor_padding_px,min_initial_source_spacing_px,min_raw_gutter_px,notes
default_128,idle;walk;run;sprint;dodge;hurt;block;interact,128,128,64,120,12,8,128,256,Default gameplay profile. Generate a fresh source strip with at least one full frame of empty space between neighboring visible poses before cleanup/repack.
expanded_action_384,attack;cast;special;skill;death;large_effect,384,384,192,376,96,8,384,3072,"Expanded action profile for large body motion, weapons, wings, tails, leaps, spells, flashes, and special effects. Use one fixed scale across the job."
monster_medium_256,idle;walk;run;sprint;dodge;hurt;block;interact,256,256,128,240,24,16,256,512,Medium monster gameplay profile. Use for monsters about 2 times character size. Preserve one fixed scale across the job and keep at least one selected-frame width of empty source spacing.
monster_medium_action_768,attack;cast;special;skill;death;large_effect,768,768,384,752,192,16,768,6144,"Medium monster expanded action profile. Use for 2x monsters with large attacks, spells, wings, tails, leaps, flashes, and special effects. Do not shrink the monster to fit smaller frames."
monster_large_384,idle;walk;run;sprint;dodge;hurt;block;interact,384,384,192,360,36,24,384,768,Large monster gameplay profile. Use for monsters about 3 times character size. Preserve one fixed scale across the job and keep at least one selected-frame width of empty source spacing.
monster_large_action_1152,attack;cast;special;skill;death;large_effect;rock_slam;rock_spray,1152,1152,576,1128,288,24,1152,9216,"Large monster expanded action profile. Use for 3x monsters with large attacks, boulders, heavy impacts, spells, wings, tails, leaps, flashes, and special effects. Do not shrink the monster to fit smaller frames."
